{
  "$schema": "https://json-schema.org/draft/2020-12/schema",
  "additionalProperties": false,
  "properties": {
    "$schema": {
      "minLength": 1,
      "type": "string"
    },
    "data": {
      "additionalProperties": false,
      "properties": {
        "identity_and_provenance": {
          "items": {
            "additionalProperties": false,
            "properties": {
              "concept": {
                "minLength": 1,
                "type": "string"
              },
              "diagnostic_impact": {
                "minLength": 1,
                "type": "string"
              },
              "disposition": {
                "enum": [
                  "PRESERVED",
                  "REMAPPED",
                  "USED_ONLY_DURING_LOWERING",
                  "USED_ONLY_AS_REACT_KEY",
                  "CONVERTED_TO_NUMERIC_ID",
                  "DROPPED",
                  "NOT_REPRESENTABLE",
                  "UNKNOWN",
                  "NORMALIZED",
                  "EXPANDED",
                  "MATERIALIZED",
                  "APPROXIMATED",
                  "FALLBACK_SUBSTITUTED",
                  "UNRESOLVED"
                ],
                "type": "string"
              },
              "final_scene_traceable": {
                "type": "boolean"
              },
              "identity_id": {
                "pattern": "^[A-Z][A-Z0-9.-]*(?:-[A-Z0-9.-]+)+$",
                "type": "string"
              },
              "source_map_available": {
                "type": "boolean"
              },
              "source_refs": {
                "items": {
                  "minLength": 1,
                  "type": "string"
                },
                "minItems": 1,
                "type": "array"
              },
              "source_representation": {
                "minLength": 1,
                "type": "string"
              },
              "target_representation": {
                "minLength": 1,
                "type": "string"
              }
            },
            "required": [
              "concept",
              "diagnostic_impact",
              "disposition",
              "final_scene_traceable",
              "identity_id",
              "source_map_available",
              "source_refs",
              "source_representation",
              "target_representation"
            ],
            "type": "object"
          },
          "minItems": 1,
          "type": "array"
        }
      },
      "required": [
        "identity_and_provenance"
      ],
      "type": "object"
    },
    "generated_at": {
      "format": "date-time",
      "type": "string"
    },
    "model_ref": {
      "minLength": 1,
      "type": "string"
    },
    "schema_version": {
      "minLength": 1,
      "type": "string"
    }
  },
  "required": [
    "$schema",
    "data",
    "generated_at",
    "model_ref",
    "schema_version"
  ],
  "type": "object"
}
